{
  "$schema": "../artifact-contracts/interface-asset-manifest.schema.json",
  "example": true,
  "authority": "non_authoritative_example",
  "bundle_id": "koa_spaces_shell_reference",
  "version": "1.0.0",
  "owner_kind": "koa_spaces_shell",
  "owner_id": "koa_spaces",
  "entrypoints": [
    "index.html"
  ],
  "assets": [
    {
      "path": "index.html",
      "media_type": "text/html",
      "sha256": "0000000000000000000000000000000000000000000000000000000000000000",
      "offline_required": true,
      "cache_policy": "versioned"
    },
    {
      "path": "assets/app.js",
      "media_type": "text/javascript",
      "sha256": "1111111111111111111111111111111111111111111111111111111111111111",
      "offline_required": true,
      "cache_policy": "immutable"
    },
    {
      "path": "assets/app.css",
      "media_type": "text/css",
      "sha256": "2222222222222222222222222222222222222222222222222222222222222222",
      "offline_required": true,
      "cache_policy": "immutable"
    }
  ],
  "remote_runtime_dependencies": [],
  "offline_policy": {
    "local_assets_complete": true,
    "public_cdn_required": false,
    "remote_fonts_required": false,
    "internet_required_for_shell": false
  },
  "compatibility": {
    "shell_min_version": "1.0.0",
    "design_system_id": "koali_spaces"
  },
  "authority_boundary": {
    "presentation_assets_only": true,
    "contains_business_authority": false,
    "contains_credentials": false
  }
}
